{
    "version": 1.0,
    "name": "sound",
    "description": "Defines a sound properties.",
    "shouldHaveParent": true,
    "parents": [
        "module"
    ],
    "parameters": [
        {
            "name": "category"
        },
        {
            "name": "clip"
        },
        {
            "name": "master"
        },
        {
            "name": "loop"
        },
        {
            "name": "maxInstancesPerEmitter"
        }
    ]
}