{
    "version": 1.0,
    "$schema": "../../$schema.json",
    "name": "CopyFrames",
    "description": "It is unknown what this block does.",
    "shouldHaveParent": true,
    "parents": [
        "animation"
    ],
    "parameters": [
        {
            "name": "frame"
        },
        {
            "name": "source"
        },
        {
            "name": "sourceFrame1"
        },
        {
            "name": "sourceFrame2"
        }
    ]
}