{
    "version": 1.0,
    "$schema": "../../$schema.json",
    "name": "component WallCoveringConfig",
    "description": "",
    "shouldHaveParent": true,
    "parents": [
        "entity"
    ],
    "parameters": [
        {
            "name": "sign"
        },
        {
            "name": "type"
        }
    ]
}