{
    "version": 1.0,
    "$schema": "../../$schema.json",
    "name": "lightbar",
    "description": "",
    "shouldHaveParent": true,
    "parents": [
        "template",
        "vehicle"
    ],
    "parameters": [
        {
            "name": "texture"
        },
        {
            "name": "soundSiren"
        },
        {
            "name": "leftCol"
        },
        {
            "name": "rightCol"
        }
    ]
}