{
    "version": 1.0,
    "$schema": "../../$schema.json",
    "name": "contextEntry",
    "description": "",
    "shouldHaveParent": true,
    "parents": [
        "component ContextMenuConfig"
    ],
    "parameters": [
        {
            "name": "menu"
        },
        {
            "name": "customFunction"
        }
    ]
}